{
  "apiVersion": 1,
  "id": "com.example.net-undeclared",
  "name": "Minimal",
  "version": "1.0.0",
  "author": {
    "name": "Fixture Author"
  },
  "license": "AGPL-3.0-only",
  "main": "main.js",
  "permissions": {
    "scripts:write": {
      "network": [
        "https://api.example.com"
      ]
    }
  }
}
