{
  "apiVersion": 1,
  "id": "com.example.b",
  "name": "B",
  "version": "1.1.0",
  "author": {
    "name": "Fixture Author"
  },
  "license": "AGPL-3.0-only",
  "main": "main.js",
  "permissions": {
    "prompter:control": {}
  },
  "includes": [
    {
      "id": "com.example.a",
      "version": "1.0.0"
    }
  ]
}
