{
  "apiVersion": 1,
  "id": "com.example.bundle",
  "name": "Studio Bundle",
  "version": "2.0.0",
  "author": {
    "name": "Fixture Author"
  },
  "license": "AGPL-3.0-or-later",
  "includes": [
    {
      "id": "com.example.a",
      "version": "1.0.0"
    },
    {
      "id": "com.example.b",
      "version": "1.1.0"
    }
  ]
}
